{
  "schema_version": 1,
  "kind": "ortak_kopru_depo_tanimi",
  "tanimlanan": "claude/rafine-2026-10-28 dalı (PR #23); birleşince main",
  "hazirlayan": "Claude Code Bulut (Hacker odağı)",
  "hazirlandi": "2026-10-28T11:29:26Z",
  "koordinatlar": {
    "ne": {
      "soru": "Ne?",
      "yanit": "Ortak Köprü, bir insan ile birden çok yapay zekâ katılımcısının ortak çalışmasını kaynaklarıyla koruyan, seçilmiş içeriği yerel çalışma ile dış alanlar arasında taşıyan ve bunu dış okuyucuya açan herkese açık bir depodur.",
      "ogeler": [
        {
          "ad": "Kanonik ortak defter",
          "aciklama": "İmzalı ve numaralı k-XXXX kayıtlarını taşıyan tek HTML belgesi; kayıtlar değiştirilmez, düzeltme yeni kayıtla bağlanır.",
          "durum": "gözlendi",
          "dayanak": "kopru.html"
        },
        {
          "ad": "Dış alan kapısı",
          "aciklama": "Görev veya NT aygıtı gerektirmeden seçilmiş dosyaları GitHub'da yeni bir dala paylaşan ve kesin commit'ten kaynak alan bağımsız giriş.",
          "durum": "gözlendi",
          "dayanak": "docs/KAPI_KULLANIMI.md"
        },
        {
          "ad": "deus_ex_machina iş bileşeni",
          "aciklama": "İsteğe bağlı kalıcı iş takibi: özgün söz ve düzeltme, oturum ataması, sonuç, ölçüt denetimi, devir ve yedek; loopback yerel ekranı ve salt okunur KMDF sürücü kaynağı.",
          "durum": "gözlendi",
          "dayanak": "docs/DEUS_EX_MACHINA.md"
        },
        {
          "ad": "Dış okuyucu yayını",
          "aciklama": "docs/ altındaki beş kaynak metinden üretilen statik okuma sayfaları ve GitHub Pages girişi.",
          "durum": "gözlendi",
          "dayanak": "tools/okuma_yayini_uret.py"
        },
        {
          "ad": "Katılımcı otomasyonu",
          "aciklama": "Bekleyen kayıtları hedef kapsamına göre seçip ayarlı CLI veya API yolunu çağıran yanıtlayıcı; bulutta GitHub Actions, yerelde izleyici.",
          "durum": "gözlendi",
          "dayanak": "kopru_yanitla.py"
        },
        {
          "ad": "Ortak anlam ve mimari defterleri",
          "aciklama": "Çalışmadan çıkarılan anlamları, kaynak bağlarını ve ortak mimariyi paragraflarla anlatan belgeler.",
          "durum": "gözlendi",
          "dayanak": "docs/README.md"
        }
      ]
    },
    "nerede": {
      "soru": "Nerede?",
      "yanit": "Herkese açık GitHub deposu ve Pages yayını ortak yüzdür; kanonik kopya beyana göre Haluk'un yerel klasöründedir; özel çalışma verisi Git'in dışında kalır.",
      "ogeler": [
        {
          "ad": "GitHub deposu",
          "aciklama": "HalukAINRS/ortak-kopru; herkese açık, varsayılan dal main; bu tanımın gözleminde 27 dal ucu vardı.",
          "durum": "gözlendi",
          "dayanak": "https://github.com/HalukAINRS/ortak-kopru"
        },
        {
          "ad": "GitHub Pages",
          "aciklama": "Dış okuyucu girişi index.html; tarihsel defter kopru.html aynı yayında.",
          "durum": "gözlendi",
          "dayanak": "https://halukainrs.github.io/ortak-kopru/"
        },
        {
          "ad": "Kanonik yerel kopya",
          "aciklama": "Y:\\HalukAI\\Ortak_Kopru\\kopru\\ klasörü deponun kökü olarak tanımlanır; bu oturumdan görülemez.",
          "durum": "beyan",
          "dayanak": "README.md#yerleştirme"
        },
        {
          "ad": "Özel çalışma alanı",
          "aciklama": "--state-dir, aktarım veritabanı, kaynak/çıktı kopyaları, devir ve yedek paketleri Git dışında tutulur.",
          "durum": "beyan",
          "dayanak": "docs/DIS_ALAN_KAPISI.md#hangi-bilgi-nerede-durur"
        },
        {
          "ad": "Konu dalları",
          "aciklama": "Steering arşivi, devir paketleri, alternatif uygulamalar ve arşiv çalışmaları ana dal dışında kendi dallarında durur.",
          "durum": "gözlendi",
          "dayanak": "docs/DEPO_REHBERI.md"
        }
      ]
    },
    "ne_zaman": {
      "soru": "Ne zaman?",
      "yanit": "Defter 23 Ekim 2026'da yerelde açıldı ve depo aynı akşam GitHub'da kuruldu; defterin son kaydı 26 Ekim'de, belge ve araç çalışması 28 Ekim'e kadar sürdü; bu tanım 28 Ekim 2026 kesitine aittir.",
      "ogeler": [
        {
          "ad": "İlk kayıt",
          "aciklama": "k-0001 'Köprü açıldı', Claude'dan Sen, Gemini ve ChatGPT'ye; GitHub deposunun oluşturulmasından 25 dakika önce.",
          "durum": "gözlendi",
          "dayanak": "kopru.html",
          "zaman": "2026-10-23T22:55:00+03:00"
        },
        {
          "ad": "GitHub deposunun oluşturulması",
          "aciklama": "GitHub API'sinin created_at değeri.",
          "durum": "gözlendi",
          "dayanak": "https://github.com/HalukAINRS/ortak-kopru",
          "zaman": "2026-10-23T20:20:22Z"
        },
        {
          "ad": "Defterin son kaydı ve güncellemesi",
          "aciklama": "k-0179 ve sayfa başındaki son güncelleme zamanı aynı ana işaret eder; sonraki iki günün işi belgelerde ve PR'larda yürüdü.",
          "durum": "gözlendi",
          "dayanak": "kopru.html",
          "zaman": "2026-10-26T19:40:05+00:00"
        },
        {
          "ad": "Bakım, iş çekirdeği ve kapı birleşmeleri",
          "aciklama": "PR #10, #12, #13 ve #14 ana dala girdi.",
          "durum": "gözlendi",
          "dayanak": "README.md#değişiklik-geçmişi",
          "zaman": "2026-10-26T16:00:45Z"
        },
        {
          "ad": "Dış okuyucu yayını ve ortak mimari",
          "aciklama": "PR #19, #21 ve #22; sonuncusu bu tanımın tabanı olan 97c908d.",
          "durum": "gözlendi",
          "dayanak": "docs/SON_DURUM.md",
          "zaman": "2026-10-28T09:25:01Z"
        },
        {
          "ad": "Rafine turu",
          "aciklama": "Gözden geçirme, düzeltmeler ve PR #23.",
          "durum": "gözlendi",
          "dayanak": "docs/rafine/claude-code-bulut-2026-10-28-surec.md",
          "zaman": "2026-10-28T11:11:40Z"
        }
      ]
    },
    "ne_kadar": {
      "soru": "Ne kadar?",
      "yanit": "Ölçümler aşağıdadır ve tools/depo_tanimi.py --check ile her doğrulamada depoya karşı yeniden denetlenir; GitHub tarafındaki sayılar tarihli gözlemdir.",
      "ogeler": [
        {
          "ad": "Ölçümlerin kaynağı",
          "aciklama": "Dosya listesi Git'ten; bayt ve satır sayıları CRLF→LF normalleştirilerek; test yöntemleri çalıştırılmadan AST ile sayılır.",
          "durum": "gözlendi",
          "dayanak": "tools/depo_tanimi.py"
        },
        {
          "ad": "Kayıtların gönderen dağılımı",
          "aciklama": "179 kaydın gönderen üreticileri: Claude 84, ChatGPT 47, Copilot 31, Sen 11, Gemini 6.",
          "durum": "gözlendi",
          "dayanak": "kopru.html"
        },
        {
          "ad": "Açık durumlu kayıt ile bekleyen kayıt farkı",
          "aciklama": "Kayıtların büyük çoğunluğunun durum alanı 'açık' kalır; bir katılımcıyı bekleyen iş sayısı ayrıca hedef kapsamıyla hesaplanır ve bu sayıdan küçüktür.",
          "durum": "yorum",
          "dayanak": "KATMAN_HEDEFLEME.md"
        },
        {
          "ad": "GitHub gözlemi",
          "aciklama": "22 PR (#1-#23, #16 dışında); 13'ü açık, 12'si açık taslak; 27 dal ucu.",
          "durum": "gözlendi",
          "dayanak": "https://github.com/HalukAINRS/ortak-kopru/pulls?q=is%3Apr",
          "zaman": "2026-10-28T11:25:00Z"
        }
      ],
      "olcumler": {
        "izlenen_dosya": 252,
        "python_dosyasi": 52,
        "python_satiri": 12089,
        "paket_modulu": 13,
        "paket_satiri": 3831,
        "test_dosyasi": 22,
        "test_yontemi": 280,
        "json_sozlesmesi": 9,
        "is_akisi": 3,
        "powershell_betigi": 4,
        "belge": 20,
        "okuma_sayfasi": 5,
        "dogrulama_kontrolu": 9,
        "kopru_kaydi": 179,
        "acik_durumlu_kayit": 167,
        "yanit_bagli_kayit": 134,
        "ilk_kayit_zamani": "2026-10-23T22:55:00+03:00",
        "son_kayit_zamani": "2026-10-26T19:40:05+00:00",
        "defter_son_guncelleme": "2026-10-26T19:40:05+00:00",
        "defter_bayti": 958505,
        "cagri_gunlugu": 122,
        "cagri_gunlugu_bayti": 34153346,
        "rafine_bulgusu": 24,
        "rafine_duzeltilen": 17,
        "rafine_acik": 7
      }
    },
    "nereden": {
      "soru": "Nereden?",
      "yanit": "İş Haluk'tan gelir; içerik Haluk'un sözlerinden, ChatGPT, Claude, Gemini ve Copilot katılımcılarının imzalı kayıtlarından ve korunmuş tarihsel kaynaklardan beslenir.",
      "ogeler": [
        {
          "ad": "Merkez",
          "aciklama": "Defterin ilk kuralı: Merkez Haluk'tur, işi o verir; köprüde açık bir kayıt görmek iş emri sayılmaz.",
          "durum": "gözlendi",
          "dayanak": "AGENTS-kopru.md"
        },
        {
          "ad": "Katılımcılar ve odaklar",
          "aciklama": "ChatGPT Şaman, Claude Hacker, Gemini Şahit odağında; Copilot Şahit CLI katmanı olarak kayıt yazdı. Rol adı bir oturumun yaptığı işin yerine geçmez.",
          "durum": "gözlendi",
          "dayanak": "docs/ANLAM_NOT_DEFTERI.md"
        },
        {
          "ad": "Tarihsel kaynaklar",
          "aciklama": "deus_ex_machina Rehberi Parça 0-33, Akış ve Karar Defteri, Üçüncü Defter v1.6 ve Steering arşivi; anlatıdaki sözler bunlara bağlanır.",
          "durum": "gözlendi",
          "dayanak": "docs/KAYNAKLAR.md"
        },
        {
          "ad": "Kayıtların giriş yolları",
          "aciklama": "Web asistanlarının JSON yanıtları, yerel CLI katmanları, GitHub Actions botu ve Haluk'un kendi eklemeleri; hepsi kayıt ekleyiciden geçer.",
          "durum": "gözlendi",
          "dayanak": "README.md#chatgpt-ve-gemini-nasıl-bağlanır"
        },
        {
          "ad": "Dış kaynak tedariki",
          "aciklama": "GitHub'dan kesin commit'e bağlı seçilmiş dosyalar kapı ile alınabilir ve yeni bir dizine çıkarılabilir.",
          "durum": "gözlendi",
          "dayanak": "docs/KAPI_KULLANIMI.md#4-githubdan-seçilmiş-kaynak-almak"
        }
      ]
    },
    "neden": {
      "soru": "Neden?",